{
  "schema_version": "1.0.0",
  "updated_at": "2026-09-22T00:00:00Z",
  "canonical_url": "https://aiplanwise.com/data/plans.json",
  "license": "CC-BY-4.0",
  "plans": [
    {
      "id": "cursor-pro",
      "vendor": "Cursor",
      "plan": "Pro",
      "category": "ai-coding-subscription",
      "billing_period": "monthly",
      "regular_price": 20,
      "intro_price": null,
      "currency": "USD",
      "annual_discount_pct": 20,
      "promo": null,
      "status": "active",
      "evidence_level": "official",
      "source_url": "https://cursor.com/pricing",
      "checked_at": "2026-09-21",
      "valid_from": null,
      "valid_until": null,
      "notes": "Annual billing discount shown on the official pricing page."
    },
    {
      "id": "claude-pro",
      "vendor": "Anthropic",
      "plan": "Claude Pro",
      "category": "general-ai-subscription",
      "billing_period": "monthly",
      "regular_price": null,
      "intro_price": null,
      "currency": "USD",
      "annual_discount_pct": null,
      "promo": "Annual option; regional pricing may apply",
      "status": "active",
      "evidence_level": "official",
      "source_url": "https://support.anthropic.com/en/articles/8325610-how-much-does-claude-pro-cost",
      "checked_at": "2026-09-21",
      "valid_from": null,
      "valid_until": null,
      "notes": "Price is intentionally null because the displayed price can vary by region."
    },
    {
      "id": "github-copilot-student",
      "vendor": "GitHub",
      "plan": "Copilot Student",
      "category": "ai-coding-subscription",
      "billing_period": "monthly",
      "regular_price": 0,
      "intro_price": null,
      "currency": "USD",
      "annual_discount_pct": null,
      "promo": "Free for verified students",
      "status": "active",
      "evidence_level": "official",
      "source_url": "https://docs.github.com/en/copilot/get-started/plans",
      "checked_at": "2026-09-21",
      "valid_from": null,
      "valid_until": null,
      "notes": "Eligibility verification is required."
    },
    {
      "id": "google-ai-pro",
      "vendor": "Google",
      "plan": "Google AI Pro",
      "category": "general-ai-subscription",
      "billing_period": "monthly",
      "regular_price": 19.99,
      "intro_price": null,
      "currency": "USD",
      "annual_discount_pct": 16,
      "promo": "Annual billing option",
      "status": "active",
      "evidence_level": "official",
      "source_url": "https://one.google.com/about/plans",
      "checked_at": "2026-09-21",
      "valid_from": null,
      "valid_until": null,
      "notes": "Savings can vary by region and billing option."
    },
    {
      "id": "command-code-go",
      "vendor": "Command Code",
      "plan": "Go",
      "category": "ai-coding-subscription",
      "billing_period": "monthly",
      "regular_price": 1,
      "intro_price": null,
      "currency": "USD",
      "annual_discount_pct": null,
      "promo": "$10 monthly model credits",
      "status": "active",
      "evidence_level": "reported",
      "source_url": "https://api.dreamfree.space/c/s/cpcommandcode",
      "checked_at": "2026-09-21",
      "valid_from": null,
      "valid_until": null,
      "notes": "Usage estimates on AIPlanWise are calculated and are not official request caps."
    },
    {
      "id": "opencode-go",
      "vendor": "OpenCode",
      "plan": "Go",
      "category": "ai-coding-subscription",
      "billing_period": "monthly",
      "regular_price": 10,
      "intro_price": 5,
      "currency": "USD",
      "annual_discount_pct": null,
      "promo": "First month $5; $60 monthly model credits",
      "status": "active",
      "evidence_level": "official",
      "source_url": "https://opencode.ai/go",
      "checked_at": "2026-09-21",
      "valid_from": null,
      "valid_until": null,
      "notes": "Model availability and credit consumption may change."
    },
    {
      "id": "freebuff-starter",
      "vendor": "Freebuff",
      "plan": "Starter",
      "category": "ai-coding-subscription",
      "billing_period": "monthly",
      "regular_price": 8,
      "intro_price": null,
      "currency": "USD",
      "annual_discount_pct": 22,
      "promo": "Up to $50 model spend",
      "status": "active",
      "evidence_level": "official",
      "source_url": "https://freebuff.com/plans",
      "checked_at": "2026-09-22",
      "valid_from": null,
      "valid_until": null,
      "notes": "Freebuff publishes model-hour allowances rather than token caps."
    },
    {
      "id": "freebuff-plus",
      "vendor": "Freebuff",
      "plan": "Plus",
      "category": "ai-coding-subscription",
      "billing_period": "monthly",
      "regular_price": 25,
      "intro_price": null,
      "currency": "USD",
      "annual_discount_pct": 22,
      "promo": "Up to $83 model spend",
      "status": "active",
      "evidence_level": "official",
      "source_url": "https://freebuff.com/plans",
      "checked_at": "2026-09-22",
      "valid_from": null,
      "valid_until": null,
      "notes": "Freebuff publishes model-hour allowances rather than token caps."
    },
    {
      "id": "freebuff-pro",
      "vendor": "Freebuff",
      "plan": "Pro",
      "category": "ai-coding-subscription",
      "billing_period": "monthly",
      "regular_price": 60,
      "intro_price": null,
      "currency": "USD",
      "annual_discount_pct": 22,
      "promo": "Up to $132 model spend",
      "status": "active",
      "evidence_level": "official",
      "source_url": "https://freebuff.com/plans",
      "checked_at": "2026-09-22",
      "valid_from": null,
      "valid_until": null,
      "notes": "Freebuff publishes model-hour allowances rather than token caps."
    },
    {
      "id": "cheaper-inference-payg",
      "vendor": "Cheaper Inference",
      "plan": "Pay as you go",
      "category": "ai-api-marketplace",
      "billing_period": "usage",
      "regular_price": null,
      "intro_price": 5,
      "currency": "USD",
      "annual_discount_pct": null,
      "promo": "Fund from $5; first funding adds $10 bonus",
      "status": "active",
      "evidence_level": "official",
      "source_url": "https://www.cheaperinference.com/docs",
      "checked_at": "2026-09-22",
      "valid_from": null,
      "valid_until": null,
      "notes": "Usage-based live market rates; no monthly commitment."
    },
    {
      "id": "phoenix-grove-taster",
      "vendor": "Phoenix Grove",
      "plan": "Taster",
      "category": "ai-coding-subscription",
      "billing_period": "monthly",
      "regular_price": 3.99,
      "intro_price": 0,
      "intro_duration_months": 1,
      "currency": "USD",
      "annual_discount_pct": null,
      "promo": "First month free",
      "monthly_tokens_min": 18000000,
      "models": [
        "DeepSeek V4.1 Flash",
        "DeepSeek V4 Flash 0731",
        "GLM 5.3 Flash"
      ],
      "privacy_claim": "100% US infrastructure; private by default; not used for model training",
      "status": "active",
      "evidence_level": "official",
      "source_url": "https://api.pgsgrove.com/",
      "checked_at": "2026-09-22",
      "valid_from": null,
      "valid_until": null,
      "notes": "One free trial month per person; duplicate trial accounts may be canceled."
    }
  ]
}

